{
  "$schema": "https://json-schema.org/draft/2020-12/schema",
  "$id": "https://github.com/enasequence/gff3tools/docs/reference-data-v2/master-entry.schema.json",
  "title": "Master entry JSON",
  "description": "Master entry JSON read by the GFF3-to-EMBL conversion (`--master-entry`). Describes the fields the converter reads. Unknown properties are allowed and ignored, and property names are matched case-insensitively by the reader; the names here are the canonical ones. References are ReferenceData v2 (see docs/2610141424_reference_data_v2.md), with legacy v1 references still accepted.",
  "type": "object",
  "properties": {
    "id": {
      "type": "string",
      "description": "Entry identifier."
    },
    "accession": {
      "type": "string"
    },
    "secondaryAccessions": {
      "type": "array",
      "items": {
        "type": "string"
      }
    },
    "description": {
      "type": [
        "string",
        "null"
      ],
      "description": "DE line."
    },
    "title": {
      "type": [
        "string",
        "null"
      ]
    },
    "version": {
      "type": "integer",
      "minimum": 1
    },
    "moleculeType": {
      "type": "string",
      "description": "e.g. \"genomic DNA\"; becomes /mol_type."
    },
    "topology": {
      "enum": [
        "linear",
        "circular"
      ],
      "description": "Read case-insensitively; other values are skipped with a warning."
    },
    "division": {
      "type": "string",
      "description": "Three-letter taxonomic division, e.g. HUM, INV, PRO."
    },
    "dataClass": {
      "type": "string",
      "description": "e.g. STD, SET, WGS."
    },
    "sequenceLength": {
      "type": "integer",
      "minimum": 0
    },
    "wgsSet": {
      "type": [
        "string",
        "null"
      ],
      "description": "WGS prefix and version, e.g. CAXMYH01."
    },
    "contigDataclass": {
      "type": [
        "string",
        "null"
      ],
      "description": "Data class given to each contig entry of a WGS set, normally WGS."
    },
    "project": {
      "type": [
        "string",
        "null"
      ],
      "description": "Project accession, e.g. PRJEB12345."
    },
    "sample": {
      "type": [
        "string",
        "null"
      ],
      "description": "Sample accession, e.g. SAMEA12345."
    },
    "taxon": {
      "type": [
        "string",
        "null"
      ],
      "description": "NCBI taxonomy id, as a string."
    },
    "scientificName": {
      "type": "string"
    },
    "commonName": {
      "type": [
        "string",
        "null"
      ]
    },
    "lineage": {
      "type": [
        "string",
        "null"
      ]
    },
    "keywords": {
      "type": [
        "array",
        "null"
      ],
      "items": {
        "type": "string"
      }
    },
    "comment": {
      "type": [
        "string",
        "null"
      ],
      "description": "CC line."
    },
    "publications": {
      "type": [
        "array",
        "null"
      ],
      "description": "Database cross-references rendered as DR lines.",
      "items": {
        "type": "object",
        "properties": {
          "id": {
            "type": "string"
          },
          "pid": {
            "type": "string",
            "description": "Alias of id."
          },
          "source": {
            "type": "string",
            "description": "e.g. BioSample, ENA."
          },
          "url": {
            "type": [
              "string",
              "null"
            ]
          }
        }
      }
    },
    "references": {
      "type": [
        "array",
        "null"
      ],
      "items": {
        "oneOf": [
          {
            "$ref": "#/$defs/referenceV2"
          },
          {
            "$ref": "#/$defs/referenceV1"
          }
        ]
      }
    },
    "chromosomeName": {
      "type": [
        "string",
        "null"
      ]
    },
    "chromosomeType": {
      "type": [
        "string",
        "null"
      ]
    },
    "chromosomeLocation": {
      "type": [
        "string",
        "null"
      ]
    },
    "firstPublic": {
      "type": [
        "string",
        "null"
      ],
      "description": "DD-MON-YYYY, e.g. 15-JAN-2024."
    },
    "firstPublicRelease": {
      "type": [
        "integer",
        "null"
      ]
    },
    "lastUpdated": {
      "type": [
        "string",
        "null"
      ],
      "description": "DD-MON-YYYY."
    },
    "lastUpdatedRelease": {
      "type": [
        "integer",
        "null"
      ]
    },
    "md5": {
      "type": [
        "string",
        "null"
      ]
    },
    "runAccessions": {
      "type": [
        "array",
        "null"
      ],
      "items": {
        "type": "string"
      }
    },
    "assemblyLevel": {
      "type": [
        "string",
        "null"
      ],
      "description": "Carried, not rendered."
    },
    "assemblyType": {
      "type": [
        "string",
        "null"
      ],
      "description": "Carried, not rendered."
    },
    "searchFields": {
      "type": [
        "object",
        "null"
      ],
      "description": "Source feature qualifiers, name to value, each emitted as /name=\"value\" on the source feature. Any qualifier name is accepted (e.g. tissue_type, isolation_source, host, collection_date, geo_loc_name, strain). Blank values are skipped. The keys organism, mol_type, topology, tax_division, md5_checksum, country, chromosome, plasmid, segment, linkage_group and organelle are ignored here because the dedicated fields above provide them. A `metagenome_source` value also adds /environmental_sample.",
      "additionalProperties": {
        "type": [
          "string",
          "null"
        ]
      }
    }
  },
  "$defs": {
    "person": {
      "type": "object",
      "description": "Each name part may be a full name or initials, with or without a period.",
      "required": [
        "surname"
      ],
      "properties": {
        "surname": {
          "type": "string",
          "minLength": 1
        },
        "firstName": {
          "type": [
            "string",
            "null"
          ]
        },
        "middleName": {
          "type": [
            "string",
            "null"
          ]
        }
      }
    },
    "xref": {
      "type": "object",
      "required": [
        "source",
        "primaryId"
      ],
      "properties": {
        "source": {
          "enum": [
            "DOI",
            "PUBMED",
            "AGRICOLA"
          ]
        },
        "primaryId": {
          "type": "string",
          "minLength": 1
        },
        "secondaryId": {
          "type": [
            "string",
            "null"
          ]
        }
      }
    },
    "date": {
      "description": "ISO-8601 calendar date or date-time.",
      "type": "string",
      "pattern": "^\\d{4}-\\d{2}-\\d{2}(T\\d{2}:\\d{2}:\\d{2}(\\.\\d+)?(Z|[+-]\\d{2}:\\d{2})?)?$"
    },
    "year": {
      "type": "integer",
      "minimum": 1000,
      "maximum": 9999
    },
    "submission": {
      "type": "object",
      "description": "Needs a valid `submittedDate`, otherwise readers fall back to UNPUBLISHED.",
      "required": [
        "submittedDate"
      ],
      "properties": {
        "submittedDate": {
          "$ref": "#/$defs/date"
        },
        "submitterAddress": {
          "type": [
            "string",
            "null"
          ]
        }
      }
    },
    "article": {
      "type": "object",
      "required": [
        "journal",
        "year"
      ],
      "properties": {
        "journal": {
          "type": "string",
          "minLength": 1
        },
        "volume": {
          "type": [
            "string",
            "null"
          ]
        },
        "issue": {
          "type": [
            "string",
            "null"
          ]
        },
        "firstPage": {
          "type": [
            "string",
            "null"
          ]
        },
        "lastPage": {
          "type": [
            "string",
            "null"
          ]
        },
        "year": {
          "$ref": "#/$defs/year"
        },
        "accepted": {
          "type": "boolean",
          "default": false,
          "description": "True for an in-press article."
        }
      }
    },
    "book": {
      "type": "object",
      "required": [
        "bookTitle",
        "publisher",
        "year",
        "editors"
      ],
      "properties": {
        "bookTitle": {
          "type": "string",
          "minLength": 1
        },
        "publisher": {
          "type": "string",
          "minLength": 1
        },
        "firstPage": {
          "type": [
            "string",
            "null"
          ]
        },
        "lastPage": {
          "type": [
            "string",
            "null"
          ]
        },
        "year": {
          "$ref": "#/$defs/year"
        },
        "editors": {
          "type": "array",
          "minItems": 1,
          "items": {
            "$ref": "#/$defs/person"
          }
        }
      }
    },
    "thesis": {
      "type": "object",
      "required": [
        "institute",
        "year"
      ],
      "properties": {
        "institute": {
          "type": "string",
          "minLength": 1
        },
        "year": {
          "$ref": "#/$defs/year"
        }
      }
    },
    "patent": {
      "type": "object",
      "required": [
        "patentOffice",
        "patentNumber",
        "patentType",
        "sequenceNumber",
        "day"
      ],
      "properties": {
        "patentOffice": {
          "type": "string",
          "pattern": "^[A-Za-z]{2}$"
        },
        "patentNumber": {
          "type": "string",
          "pattern": "^[A-Za-z0-9]+$"
        },
        "patentType": {
          "type": "string",
          "pattern": "^[A-Za-z0-9]+$"
        },
        "sequenceNumber": {
          "type": "integer",
          "minimum": 1
        },
        "day": {
          "$ref": "#/$defs/date"
        },
        "applicants": {
          "type": [
            "array",
            "null"
          ],
          "items": {
            "type": "string"
          }
        }
      }
    },
    "electronic": {
      "type": "object",
      "required": [
        "text"
      ],
      "properties": {
        "text": {
          "type": "string",
          "minLength": 1
        }
      }
    },
    "unpublished": {
      "type": "object",
      "properties": {
        "journalBlock": {
          "type": [
            "string",
            "null"
          ],
          "description": "Carried, not rendered."
        }
      }
    },
    "referenceV2": {
      "type": "object",
      "description": "v2 reference: `type` is required. The type-specific block is named after the lower-case `type`.",
      "required": [
        "referenceNumber",
        "type"
      ],
      "properties": {
        "referenceNumber": {
          "type": "integer",
          "minimum": 1,
          "description": "RN"
        },
        "type": {
          "enum": [
            "SUBMISSION",
            "UNPUBLISHED",
            "ARTICLE",
            "BOOK",
            "THESIS",
            "PATENT",
            "ELECTRONIC"
          ],
          "description": "Discriminator. Readers treat an unknown value as UNPUBLISHED and log a warning."
        },
        "referencePosition": {
          "type": [
            "string",
            "null"
          ],
          "description": "RP, e.g. \"1-1470\" or \"1-100,200-300\"."
        },
        "referenceComment": {
          "type": [
            "string",
            "null"
          ]
        },
        "title": {
          "type": [
            "string",
            "null"
          ],
          "description": "RT"
        },
        "consortium": {
          "type": [
            "string",
            "null"
          ],
          "description": "RG: a group or consortium name. Put a consortium here, not in `authors`."
        },
        "authors": {
          "type": [
            "array",
            "null"
          ],
          "description": "RA, one entry per person.",
          "items": {
            "$ref": "#/$defs/person"
          }
        },
        "xrefs": {
          "type": [
            "array",
            "null"
          ],
          "description": "RX",
          "items": {
            "$ref": "#/$defs/xref"
          }
        },
        "submission": {
          "oneOf": [
            {
              "$ref": "#/$defs/submission"
            },
            {
              "type": "null"
            }
          ]
        },
        "article": {
          "oneOf": [
            {
              "$ref": "#/$defs/article"
            },
            {
              "type": "null"
            }
          ]
        },
        "book": {
          "oneOf": [
            {
              "$ref": "#/$defs/book"
            },
            {
              "type": "null"
            }
          ]
        },
        "thesis": {
          "oneOf": [
            {
              "$ref": "#/$defs/thesis"
            },
            {
              "type": "null"
            }
          ]
        },
        "patent": {
          "oneOf": [
            {
              "$ref": "#/$defs/patent"
            },
            {
              "type": "null"
            }
          ]
        },
        "electronic": {
          "oneOf": [
            {
              "$ref": "#/$defs/electronic"
            },
            {
              "type": "null"
            }
          ]
        },
        "unpublished": {
          "oneOf": [
            {
              "$ref": "#/$defs/unpublished"
            },
            {
              "type": "null"
            }
          ]
        }
      },
      "allOf": [
        {
          "if": {
            "properties": {
              "type": {
                "const": "SUBMISSION"
              }
            }
          },
          "then": {
            "required": [
              "submission"
            ],
            "properties": {
              "submission": {
                "type": "object"
              }
            }
          }
        },
        {
          "if": {
            "properties": {
              "type": {
                "const": "ARTICLE"
              }
            }
          },
          "then": {
            "required": [
              "article"
            ],
            "properties": {
              "article": {
                "type": "object"
              }
            }
          }
        },
        {
          "if": {
            "properties": {
              "type": {
                "const": "BOOK"
              }
            }
          },
          "then": {
            "required": [
              "book"
            ],
            "properties": {
              "book": {
                "type": "object"
              }
            }
          }
        },
        {
          "if": {
            "properties": {
              "type": {
                "const": "THESIS"
              }
            }
          },
          "then": {
            "required": [
              "thesis"
            ],
            "properties": {
              "thesis": {
                "type": "object"
              }
            }
          }
        },
        {
          "if": {
            "properties": {
              "type": {
                "const": "PATENT"
              }
            }
          },
          "then": {
            "required": [
              "patent"
            ],
            "properties": {
              "patent": {
                "type": "object"
              }
            }
          }
        },
        {
          "if": {
            "properties": {
              "type": {
                "const": "ELECTRONIC"
              }
            }
          },
          "then": {
            "required": [
              "electronic"
            ],
            "properties": {
              "electronic": {
                "type": "object"
              }
            }
          }
        }
      ]
    },
    "referenceV1": {
      "type": "object",
      "description": "Legacy (v1) reference: no `type`. Still read by the converter; new producers should emit v2. Submission data lives in `submitterDetails`. Not valid together with a `type`.",
      "not": {
        "required": [
          "type"
        ]
      },
      "properties": {
        "referenceNumber": {
          "type": "integer",
          "minimum": 1
        },
        "number": {
          "type": "integer",
          "minimum": 1,
          "description": "Alias of referenceNumber."
        },
        "referencePosition": {
          "type": [
            "string",
            "null"
          ]
        },
        "referenceComment": {
          "type": [
            "string",
            "null"
          ]
        },
        "title": {
          "type": [
            "string",
            "null"
          ]
        },
        "consortium": {
          "type": [
            "string",
            "null"
          ]
        },
        "group": {
          "type": [
            "string",
            "null"
          ],
          "description": "Alias of consortium."
        },
        "authors": {
          "description": "Ignored by the converter in v1 records (RA comes from submitterDetails.authors). Free text or a list.",
          "type": [
            "string",
            "array",
            "null"
          ]
        },
        "submitterDetails": {
          "type": [
            "object",
            "null"
          ],
          "properties": {
            "submittedDate": {
              "$ref": "#/$defs/date"
            },
            "submissionAccount": {
              "type": [
                "object",
                "null"
              ],
              "properties": {
                "brokerName": {
                  "type": [
                    "string",
                    "null"
                  ]
                },
                "centerName": {
                  "type": [
                    "string",
                    "null"
                  ]
                },
                "laboratoryName": {
                  "type": [
                    "string",
                    "null"
                  ]
                },
                "address": {
                  "type": [
                    "string",
                    "null"
                  ]
                },
                "country": {
                  "type": [
                    "string",
                    "null"
                  ]
                }
              }
            },
            "authors": {
              "type": [
                "array",
                "null"
              ],
              "items": {
                "$ref": "#/$defs/person"
              }
            }
          }
        }
      }
    }
  },
  "required": [
    "accession"
  ],
  "additionalProperties": true
}
