{
  "accession": "CAXMYH010000000",
  "dataClass": "SET",
  "contigDataclass": "WGS",
  "wgsSet": "CAXMYH01",
  "division": "INV",
  "moleculeType": "genomic DNA",
  "topology": "linear",
  "sequenceLength": 11435,
  "scientificName": "Tribolium castaneum",
  "taxon": "7070",
  "lineage": "Eukaryota; Metazoa; Arthropoda; Insecta; Coleoptera; Tenebrionidae; Tribolium.",
  "project": "PRJEB12345",
  "sample": "SAMEA115421145",
  "runAccessions": ["ERR12930749"],
  "references": [
    {
      "number": 1,
      "title": "WGS sequencing of Tribolium castaneum",
      "submitterDetails": {
        "submittedDate": "2024-01-15T00:00:00Z",
        "submissionAccount": {
          "centerName": "EBI",
          "laboratoryName": "European Bioinformatics Institute",
          "address": "Wellcome Genome Campus, Hinxton CB10 1SA",
          "country": "United Kingdom"
        },
        "authors": [
          { "firstName": "Jane", "surname": "Smith" }
        ]
      }
    }
  ]
}
