{
  "id": "GCA_000001405.29",
  "accession": "CAXMMS010000001",
  "secondaryAccessions": ["CAXMMS000000000"],
  "description": "Homo sapiens genome assembly",
  "title": "Human Genome Assembly",
  "version": 1,
  "moleculeType": "genomic DNA",
  "topology": "linear",
  "division": "HUM",
  "dataClass": "STD",
  "project": "PRJEB12345",
  "sample": "SAMEA12345",
  "taxon": "9606",
  "scientificName": "Homo sapiens",
  "commonName": "human",
  "lineage": "Eukaryota; Metazoa; Chordata; Mammalia; Primates; Hominidae; Homo.",
  "keywords": ["WGS", "genome"],
  "comment": "This is a test assembly",
  "chromosomeName": "chr1",
  "chromosomeType": "Chromosome",
  "chromosomeLocation": "Nuclear",
  "firstPublic": "15-JAN-2024",
  "firstPublicRelease": 144,
  "lastUpdated": "01-JUN-2024",
  "lastUpdatedRelease": 144,
  "assemblyLevel": "chromosome",
  "assemblyType": "primary metagenome",
  "publications": [
    {
      "pid": "SAMEA12345",
      "source": "BioSample"
    }
  ],
  "references": [
    {
      "number": 1,
      "group": "Human Genome Consortium",
      "title": "The human genome",
      "submitterDetails": {
        "submittedDate": "2024-01-15T00:00:00Z",
        "submissionAccount": {
          "centerName": "EBI",
          "laboratoryName": "Wellcome Genome Campus",
          "address": "Hinxton CB10 1SA",
          "country": "United Kingdom"
        },
        "authors": [
          { "firstName": "John", "surname": "Smith" },
          { "firstName": "Alice", "surname": "Doe" }
        ]
      }
    }
  ]
}
